{
 "schema": 1,
 "id": "generic/media/tv/curved-tv-55",
 "name": {
  "en": "Curved TV 55\" on stand",
  "de": "Curved-Fernseher 55\" mit Standfu\u00df"
 },
 "category": "media/tv",
 "manufacturer": null,
 "model": null,
 "variant": "55 inch, radius 4200R",
 "dimensions": {
  "w": 1.23,
  "d": 0.24,
  "h": 0.8
 },
 "mount": "floor",
 "ha": {
  "domains": [
   "media_player"
  ]
 },
 "tags": [
  "tv",
  "curved",
  "screen",
  "display"
 ],
 "license": "CC0-1.0",
 "author": "hometwin",
 "generated_by": "hometwin example (screen convention)",
 "sources": [],
 "created": "2026-10-16"
}
